order_id,customer_id,date,nearest_warehouse,shopping_cart,order_price,delivery_charges,customer_lat,customer_long,coupon_discount,order_total,season,is_expedited_delivery,distance_to_nearest_warehouse,latest_customer_review,is_happy_customer
ORD020832,ID3313210932,2019-11-07,Nickolson,"[('Thunder line', 1), ('Olivia x460', 2)]",4630,72.45,-37.818590500000006,144.96699669999995,15,4007.95,Spring,False,0.2246,"don't expect too much. lower quality than expected. however, it was good because it was good performance.",True
ORD335598,ID0581702933,2019-12-17,Thompson,"[('Thunder line', 2), ('Candle Inferno', 2), ('Universe Note', 2)]",12120,71.9,-37.8153797,144.92251059999995,10,10979.9,Summer,False,2.1806,waste of money battery died after about three months. was a lucent fan for years but no longer.i want a refund!!! where is my refund?!,False
ORD183631,ID0370750714,2019-07-18,Bakers,"[('Olivia x460', 1), ('Toshika 750', 1), ('pearTV', 2), ('Alcon 10', 2)]",36065,60.9,-37.8122486,144.9884905,25,27109.65,Winter,True,0.6437,not impressed very disappointed with this phone. missing features that should be common. like tap screen to wake up. to many apps no one needs that you can't delete. camera very poor. struggles to focus. the full screen looks nice but just a little pressure on an edge opens up apps. just overall not what i was hoping for in a phone.,False
ORD418901,ID1492150953,2019-01-31,Thompson,"[('Thunder line', 1), ('iAssist Line', 1), ('pearTV', 1)]",10715,90.21,-37.8145433,144.9520468,0,10805.21,Summer,True,0.4847,"great, good purchase! i received the cellphone in great condition including all accesories. it works great in argentina! thanks!",True
ORD378801,ID0587652966,2019-08-03,Nickolson,"[('Alcon 10', 1), ('Candle Inferno', 1), ('pearTV', 1), ('Thunder line', 1)]",17870,66.04,-37.8253478,144.9585279,0,17936.04,Winter,False,1.2266,love it yes buy buy and buy it is worth every penny,True
ORD499972,ID3555802212,2019-04-15,Thompson,"[('iAssist Line', 2), ('iStream', 2)]",4750,65.71,-37.805884000000006,144.9366626,10,4340.71,Autumn,False,1.1869,five stars excellent lower cost option to replacing my wife's note 4.,True
ORD153153,ID0128982276,2019-06-28,Nickolson,"[('Universe Note', 2), ('pearTV', 1), ('iAssist Line', 2), ('Olivia x460', 2)]",20110,63.09,-37.81780379999999,144.9624239,10,18162.09,Winter,False,0.6329,"extremely happy with this decision without getting all technical.... if you don't need the latest greatest (s6, s6 edge, note4) this thing is a powerhouse unto itself. i am very happy with my decision and for the price ($20 with 2yr contract) how could i not be?",True
ORD173432,ID5080636820,2019-07-01,Nickolson,"[('Lucent 330S', 2), ('iAssist Line', 1)]",4685,54.47,-37.8070375,144.9764039,25,3568.22,Winter,False,1.4207,"not sure is buying refurbished is the way to go.... when on speaker phone, the person on the other end heard an thunder and when using skype, the call would connect and immediately disconnect.",False
ORD013674,ID3185718963,2019-05-20,Bakers,"[('pearTV', 1), ('Universe Note', 2), ('Thunder line', 1), ('Lucent 330S', 1)]",16620,82.12,-37.79924550000001,144.98789019999995,5,15871.12,Autumn,True,1.3598,worth it! came earlier than stated and works perfectly fine :),True
ORD045023,ID0664379342,2019-04-29,Nickolson,"[('Candle Inferno', 2), ('pearTV', 1), ('Toshika 750', 1), ('Universe Note', 1)]",14940,77.36,-37.82048,144.9657125,0,15017.36,Autumn,True,0.3974,good product good,True
ORD432595,ID2189497243,2019-01-18,Nickolson,"[('Olivia x460', 1), ('Thunder line', 2), ('Lucent 330S', 1)]",6815,59.48,-37.81031779999999,144.9727405,10,6192.98,Summer,False,0.9631,junk phone lasted 60 days after paying $200+. phone stopped charging,False
ORD286743,ID6206949956,2019-06-22,Nickolson,"[('Lucent 330S', 2), ('pearTV', 2), ('Alcon 10', 1), ('Toshika 750', 1)]",28350,73.58,-37.816051,144.9694919,15,24171.08,Winter,True,0.2832,"good for me wife loves her new phone. happy wife, happy life",True
ORD026755,ID0282825759,2019-08-16,Thompson,"[('Olivia x460', 2), ('Candle Inferno', 2)]",3310,69.28,-37.8019407,144.952397,15,2882.78,Winter,False,1.2833,great phone awesome,True
ORD232865,ID2642814904,2019-03-14,Thompson,"[('Olivia x460', 1), ('iStream', 2), ('pearTV', 2), ('Universe Note', 2)]",21045,79.01,-37.8214747,144.9444227,5,20071.76,Autumn,True,1.007,amazing features!!! worth it!!!!,True
ORD040955,ID3313046869,2019-10-05,Thompson,"[('Alcon 10', 2), ('Universe Note', 2)]",24800,101.07,-37.8171138,144.95346990000004,25,18701.07,Spring,True,0.7491,"updated phone with android 9 bought this phone to replace a new blu phone with a few more toys, like fingerprint reader, but the blu phone crashed after two days, i found the olivia a10 which is an older model that works well and thought i would give it a try.",True
ORD267776,ID2249465789,2019-11-24,Bakers,"[('Universe Note', 2), ('Toshika 750', 1)]",11220,116.63,-37.8273797,145.0136202,15,9653.63,Spring,True,2.5217,very good. very good.,True
ORD392049,ID0600744903,2019-05-31,Nickolson,"[('Thunder line', 2), ('iAssist Line', 2), ('Toshika 750', 1), ('Candle Inferno', 1)]",13560,64.03,-37.811723,144.96525559999995,15,11590.03,Autumn,True,0.8532,dosnt work internet and picture messages won't work if you use this phone with t-mobile .... they only work with wifi on ... pointless,False
ORD490167,ID0634775866,2019-05-07,Thompson,"[('Lucent 330S', 2), ('Thunder line', 1), ('Olivia x460', 2), ('iAssist Line', 1)]",9315,65.94,-37.815178,144.9366701,5,8915.19,Autumn,False,0.956,five stars great buy!!!,True
ORD019010,ID3065030527,2019-01-11,Bakers,"[('iStream', 2), ('Toshika 750', 2)]",8940,92.34,-37.8030788,144.9984441,25,6797.34,Summer,True,0.8202,great price my father seems to love it!,True
ORD286809,ID0471341114,2019-08-11,Nickolson,"[('iAssist Line', 1), ('Lucent 330S', 2), ('iStream', 1)]",4835,81.38,-37.8036072,144.96745009999995,0,4916.38,Winter,True,1.6786,great phone gtreat phone,True
ORD306026,ID1668523193,2019-06-20,Thompson,"[('Thunder line', 2), ('Candle Inferno', 2), ('Olivia x460', 2), ('pearTV', 1)]",13980,74.52,-37.814529,144.9457594,10,12656.52,Winter,True,0.2365,five stars great !,True
ORD220692,ID0250479854,2019-12-19,Bakers,"[('iStream', 1), ('Thunder line', 1), ('pearTV', 2), ('Universe Note', 1)]",18400,60.26,-37.81509060000001,145.0060096,10,16620.26,Summer,False,1.1045,phone didnt work right. the phone was defective. it would work as normal and then suddenly begin restarting itself. my lte constantly went in and out and phone said no service. switched to verizon thinking maybe it was metropcs. nope. the phone is messed up it isnt even really usable. very frustrating....,False
ORD034874,ID4294474623,2019-10-11,Nickolson,"[('Candle Inferno', 1), ('iStream', 1)]",580,65.93,-37.8053644,144.9737134,25,500.93,Spring,False,1.5176,"horrible reception on 2g and 3g areas i pulled my sims card out of my universe s5 and installed it in my universe a10, the phone couldn't get reception 80% of the time on my normal drive here in the usa, my universe s5 on that same drive had service the whole drive, not a reliable phone",False
ORD074102,ID0634784034,2019-06-23,Thompson,"[('pearTV', 1), ('Alcon 10', 1)]",15260,65.74,-37.8133342,144.9368117,10,13799.74,Winter,False,0.905,"phone is okay.. could be nice phone is even though is refurbished, it's wasn't even charge at all. there was some scratches that why i took some phone some minor star",True
ORD168714,ID0311908633,2019-01-14,Thompson,"[('Lucent 330S', 2), ('iAssist Line', 2), ('Thunder line', 2)]",11270,100.31,-37.8036633,144.9626737,15,9679.81,Summer,True,1.6998,great phone its real i just want to say you should buy this !! its legit ive had this phone for 6 months now and it works great. ive bought two phones from digico and havent been disappointed,True
ORD486952,ID2658978751,2019-07-27,Bakers,"[('Toshika 750', 2), ('Alcon 10', 2), ('Thunder line', 2), ('Lucent 330S', 2)]",33360,67.66,-37.8180775,145.0140264,15,28423.66,Winter,True,1.8818,"defective product!!! product was defective, still waiting to get my refund",False
ORD370833,ID0356089138,2019-12-17,Bakers,"[('Alcon 10', 1), ('iAssist Line', 2)]",13400,79.1,-37.8181162,144.9951082,10,12139.1,Summer,True,0.904,"garbage this phone worked well for 1 month,then all kinds of malfunctions began to happen. very unhappy, i have to buy a new phone again.",False
ORD312275,ID0371967864,2019-10-16,Nickolson,"[('iStream', 1), ('Lucent 330S', 1), ('Alcon 10', 1), ('Thunder line', 2)]",14690,81.16,-37.8070268,144.9709796,0,14771.16,Spring,False,1.2939,"five stars great phone, kid loves it! great price as well. recommended",True
ORD056557,ID0591233417,2019-05-18,Thompson,"[('Olivia x460', 2), ('iStream', 1), ('Universe Note', 2)]",9500,81.14,-37.8245751,144.95283659999996,5,9106.14,Autumn,True,1.4186,good buy sturdy. exact fit. good price. ribbed surface makes it stick in your hand. good buy. recommend to protect an expensive device.,True
ORD361279,ID0157849660,2019-03-16,Nickolson,"[('iAssist Line', 1), ('Universe Note', 1), ('Alcon 10', 1)]",14625,49.74,-37.8207776,144.9617034,25,11018.49,Autumn,False,0.7316,two stars not for my sim,False
ORD272393,ID0250774446,2019-03-14,Bakers,"[('Lucent 330S', 2), ('iStream', 1), ('Universe Note', 1)]",6060,83.13,-37.8158448,145.013596,10,5537.13,Autumn,True,1.7413,exactly what i was hoping for i'm impressed! for a refurbished phone it looks brand new. absolutely love the camera! グ,True
ORD024063,ID0581733257,2019-04-10,Thompson,"[('Olivia x460', 1), ('pearTV', 2), ('Alcon 10', 2), ('iStream', 2)]",32045,69.02,-37.8047365,144.9270512,0,32114.02,Autumn,False,1.9698,"brand new phone the phone is brand new and perfect, i bought it from the seller arz technologies. i highly recommed this seller",True
ORD462840,ID1224869091,2019-12-02,Thompson,"[('Toshika 750', 1), ('Universe Note', 2), ('Candle Inferno', 2), ('pearTV', 1)]",18390,91.37,-37.8134865,144.94080480000005,15,15722.87,Summer,True,0.5583,good phone for the money this was he first full-featured smart phone purchased for my wife. the fingerprint reader was the main attraction for quick access. the phone seems to be a good value for the money.,True
ORD160250,ID1621189025,2019-12-28,Thompson,"[('Alcon 10', 2), ('Universe Note', 1), ('iStream', 1)]",21500,68.82,-37.8152223,144.9448829,0,21568.82,Summer,False,0.3427,"great product. good product, delivered on time. works well. have used in south africa and central america. would not hesitate to purchase this again.",True
ORD433431,ID0306905245,2019-12-11,Thompson,"[('iStream', 1), ('Thunder line', 1), ('Toshika 750', 2), ('iAssist Line', 1)]",13195,93.0,-37.8116403,144.93834980000003,10,11968.5,Summer,True,0.7754,works great! looks brand new! love my new thunder line. i will be getting them for all the main rooms in the house.,True
ORD217039,ID6167489484,2019-08-27,Nickolson,"[('Alcon 10', 1), ('pearTV', 1), ('Thunder line', 2), ('Toshika 750', 2)]",28260,74.95,-37.81791870000001,144.9618773,0,28334.95,Winter,True,0.679,no scratch on screen phone came in excellent condition,True
ORD391385,ID0581715612,2019-01-21,Thompson,"[('iStream', 2), ('Candle Inferno', 1), ('iAssist Line', 2)]",5180,79.82,-37.805324,144.933267,5,5000.82,Summer,False,1.4638,five stars yes just what dad needed! thank you!,True
ORD198739,ID0049492967,2019-01-11,Nickolson,"[('Universe Note', 2), ('Olivia x460', 1), ('iStream', 2), ('Lucent 330S', 2)]",10885,86.37,-37.8194705,144.9719779,15,9338.62,Summer,True,0.2346,works great phone works as advertised. it was just what the buyer was looking for as far as a phone goes. works great.,True
ORD071657,ID1888340704,2019-04-30,Bakers,"[('pearTV', 2), ('Alcon 10', 1)]",21570,41.65,-37.7938788,144.9851776,0,21611.65,Autumn,True,2.0002,will buy again i love this phone. it is responsive and easy to use. it accepts a ds card which is great as i take a lot of pictures. great camera too.,True
ORD441224,ID1492145812,2019-08-10,Thompson,"[('iAssist Line', 2), ('Thunder line', 2), ('Olivia x460', 1), ('Alcon 10', 2)]",27935,47.02,-37.8130944,144.9516264,15,23791.77,Winter,False,0.4035,lack of seriousness in delivery times are not real https://www.digico.com/dp/b01cju9bbm/ref=cm_cr_ryp_prd_ttl_sol_0,False
ORD141192,ID2948774554,2019-11-10,Nickolson,"[('Toshika 750', 1), ('Alcon 10', 2), ('iStream', 1), ('pearTV', 2)]",34990,65.04,-37.8081641,144.9711114,5,33305.54,Spring,False,1.1692,don't buy its very low quantity sent in for warranty battery will not charge right.because a crack in the camera lens they will not warranty or repair the device.,False
ORD339415,ID0581708340,2019-05-05,Thompson,"[('Olivia x460', 2), ('Toshika 750', 2), ('Alcon 10', 1)]",20040,68.74,-37.8057961,144.9295725,10,18104.74,Autumn,False,1.7187,"bought for daughter, love the parental control and curfew setting",True
ORD249988,ID0373652149,2019-06-06,Thompson,"[('iStream', 2), ('Thunder line', 1)]",2480,126.21000000000001,-37.811604,144.9268487,10,2358.21,Winter,True,1.7822,"five stars best phone available, until the note 4 comes out.",True
ORD417465,ID1833110279,2019-04-20,Nickolson,"[('Olivia x460', 1), ('Lucent 330S', 1)]",2455,62.85,-37.8178063,144.9660039,10,2272.35,Autumn,False,0.324,five stars phone works great,True
ORD161089,ID1224869055,2019-08-02,Thompson,"[('Thunder line', 2), ('pearTV', 2), ('iStream', 2), ('Toshika 750', 1)]",21600,32.86,-37.8129196,144.9405217,15,18392.86,Winter,False,0.5764,five stars so far works great,True
ORD452314,ID0315714849,2019-12-14,Bakers,"[('iStream', 2), ('Lucent 330S', 2), ('Toshika 750', 2), ('Thunder line', 1)]",13580,74.93,-37.8096183,145.0008213,5,12975.93,Summer,True,0.4934,sucks completely sucks.,False
ORD157421,ID3215191976,2019-05-29,Thompson,"[('iStream', 1), ('Toshika 750', 2), ('pearTV', 2), ('Thunder line', 2)]",25770,64.91,-37.8076972,144.9554438,10,23257.91,Autumn,False,0.9216,"alright great phone but i tried it with at&t an it didn't work, had 2 get another phone instead.",True
ORD164544,ID0419481494,2019-11-03,Bakers,"[('Olivia x460', 2), ('Alcon 10', 1), ('iAssist Line', 1), ('Universe Note', 1)]",17075,77.41,-37.8187507,144.99606430000003,10,15444.91,Spring,False,0.9773,excellent amazing cell phone,True
ORD427471,ID5290706364,2019-04-05,Nickolson,"[('Olivia x460', 2), ('Lucent 330S', 1), ('Candle Inferno', 2), ('Toshika 750', 2)]",13180,84.01,-37.8082574,144.9766257,5,12605.01,Autumn,True,1.3082,"buyers beware its a beautiful phone with lots of potential but i made the mistake of purchasing without checking if any network in my area would support it, and none do.",True
ORD006751,ID3212024917,2019-09-17,Thompson,"[('Alcon 10', 2), ('iAssist Line', 1)]",20125,97.27,-37.808466,144.9480456,10,18209.77,Spring,True,0.4761,great phone got this used through an digico seller and i was very pleased with the quality for the price. i love this phone's camera!,True
ORD068163,ID6167231003,2019-02-26,Thompson,"[('Lucent 330S', 2), ('Olivia x460', 2), ('Thunder line', 1), ('Candle Inferno', 2)]",7950,76.03,-37.8188878,144.9538868,15,6833.53,Summer,False,0.9154,a real peach! does everything you expect from a smart phone (including that fruit one) at a fraction of the price. battery usage has to be monitored as leaving certain apps running will deplete it quickly.,True
ORD161599,ID4655129032,2019-08-03,Thompson,"[('Thunder line', 1), ('pearTV', 2), ('Alcon 10', 2)]",32700,58.85,-37.8089487,144.94858290000005,10,29488.85,Winter,True,0.4355,"keeps freezing an every time it updates it freezes an ... keeps freezing an every time it updates it freezes an have shut it down,the charger that came with it don't even charge the phone, sorry to say but going back alcon,",False
ORD258901,ID4969353898,2019-02-21,Thompson,"[('pearTV', 2), ('iAssist Line', 1), ('Universe Note', 1), ('Alcon 10', 2)]",36195,76.56,-37.8155051,144.935688,5,34461.81,Summer,False,1.0493,five stars great!,True
ORD027636,ID0777769015,2019-05-24,Thompson,"[('Toshika 750', 2), ('Olivia x460', 2), ('Alcon 10', 1)]",20040,67.56,-37.8043073,144.957566,0,20107.56,Autumn,False,1.3113,"for less than $100 a great value so far this phone has lived up to all my expectations. i paid, $93.95 for the phone and works great with t-mobile.",True
ORD449249,ID2346984255,2019-07-24,Thompson,"[('pearTV', 2), ('Candle Inferno', 2)]",13480,65.52,-37.8208435,144.94731000000004,0,13545.52,Winter,False,0.9097,five stars great phone. exceeded my expectations. best flip phone i have ever owned.,True
ORD491022,ID2289892402,2019-06-12,Nickolson,"[('Toshika 750', 2), ('Thunder line', 2), ('Candle Inferno', 2)]",13860,52.9,-37.8087811,144.9613149,15,11833.9,Winter,False,1.3107,"not user friendly let alone ""senior friendly"".... this was supposed to be a senior friendly phone but i can't even use it let alone my 80 year old father....the screen locks incessantly, nothing deletes properly, the up down keys are unusable....",False
ORD468632,ID6237546444,2019-01-09,Bakers,"[('Candle Inferno', 1), ('Alcon 10', 1), ('Universe Note', 2), ('Olivia x460', 2)]",18730,146.98499999999999,-37.80115120000001,145.003712,5,17940.485,Summer,True,1.2352,price i like,True
ORD232759,ID0356449717,2019-09-16,Bakers,"[('Lucent 330S', 2), ('Candle Inferno', 2), ('pearTV', 1), ('Olivia x460', 2)]",12080,74.26,-37.8081254,144.9867964,15,10342.26,Spring,False,0.7706,"equipo nuevo, a tiempo pero con cargador europeo. el producto me lleg贸 a tiempo, sellado en perfectas condiciones. negativo: el 煤nico detalle es que el cargador es europeo. fuera de eso, todo fue genial con el comprador.",True
ORD174378,ID1713460710,2019-08-23,Nickolson,"[('Thunder line', 1), ('Toshika 750', 1), ('Lucent 330S', 2)]",8960,76.04,-37.8094168,144.97222140000005,0,9036.04,Winter,True,1.0483,great phone phone was in great condition! it was delivered as expected. it also came with a shatter glass protector on the phone,True
ORD397335,ID1479928147,2019-12-13,Thompson,"[('Lucent 330S', 2), ('Toshika 750', 1)]",6780,77.17,-37.8215784,144.9554098,25,5162.17,Summer,False,1.2332,"open answer, close good-bye. great and very simple (open and answer, close and hang up). i bought it for a person with a brain injury and it's good.",True
ORD347755,ID6206959532,2019-09-29,Thompson,"[('Toshika 750', 1), ('Thunder line', 1), ('Alcon 10', 1)]",15450,92.77,-37.8223792,144.9340469,0,15542.77,Spring,True,1.5744,"caja del celular abierta la caja del celular llego abierto, y yo compre el celular nuevo, que paso?",False
ORD318510,ID3215106501,2019-02-27,Thompson,"[('iAssist Line', 1), ('Alcon 10', 2), ('iStream', 1)]",20275,70.89,-37.8080044,144.9541174,15,17304.64,Summer,False,0.8089,"5 stars super fast delivery , best phone out there by far very happy",True
ORD356796,ID0030942256,2019-03-26,Thompson,"[('Toshika 750', 1), ('pearTV', 2), ('Olivia x460', 2), ('Alcon 10', 2)]",37290,79.99,-37.8054874,144.9429733,0,37369.99,Autumn,True,0.8773,product was clean as new with unused original olivia charger ... product was clean as new with unused original olivia charger and memory card waa also in slot which comes with phone. worth to buy it.,True
ORD003157,ID1463620399,2019-01-26,Bakers,"[('Toshika 750', 1), ('Universe Note', 1)]",7770,80.67,-37.81700170000001,145.0049113,5,7462.17,Summer,True,1.1544,"unreliable there's nothing fancy to this phone. it's the most basic 90's phone you can get. which is what i needed for my mom. it never got the clearest signal, and would make loud screeching noises from time to time during a conversation. it broke on the second week of using it. the screen went black and there was no way to fix it.",False
ORD455231,ID0370750444,2019-11-26,Bakers,"[('Alcon 10', 2), ('Candle Inferno', 2)]",18760,79.42,-37.81658779999999,144.98765869999997,10,16963.42,Spring,False,0.991,good excelente,True
ORD175482,ID0846566059,2019-08-16,Nickolson,"[('pearTV', 2), ('Candle Inferno', 1), ('Universe Note', 1)]",16500,63.34,-37.8235665,144.96803880000004,15,14088.34,Winter,False,0.5692,"it's slim and nicely designed am loving my new phone everything works perfectly, since am a professional photographer the phone camera do not matter to much i haven't use the camera, yes i'!! recommend this phone to anyone who wants to buy it.",True
ORD372992,ID0746912572,2019-08-18,Nickolson,"[('Alcon 10', 1), ('iStream', 2)]",9250,80.14,-37.8242741,144.9831252,0,9330.14,Winter,True,1.3507,good upgrade from my note 5 personal use. just received 3 days prior and activated a day. have not had time to assess fingerprint reader.,True
ORD410398,ID0547569034,2019-07-30,Bakers,"[('pearTV', 1), ('Olivia x460', 1), ('Thunder line', 2)]",11895,75.16,-37.8101569,144.9888213,25,8996.41,Winter,True,0.5641,looks new product looked better than new. i was skeptical about buying refurbished it surpassed my expectations.,True
ORD179746,ID5402876205,2019-08-09,Nickolson,"[('iAssist Line', 1), ('Thunder line', 2)]",6585,78.45,-37.8216064,144.9779458,15,5675.7,Winter,True,0.8107,"friggin amazing i love how this has stock android. if you dont have enough dough to buy any of the google pixel devices then this is in the top 5 android one devices. the color of the gold blue is amazing. its not too much, its subtle and beautiful.",True
ORD267136,ID3215102054,2019-09-07,Thompson,"[('Lucent 330S', 2), ('Universe Note', 1), ('Thunder line', 1)]",8090,74.14,-37.8122158,144.9516685,5,7759.64,Spring,False,0.4077,perfect every thing is perfect,True
ORD481874,ID5001030294,2019-09-30,Thompson,"[('pearTV', 1), ('Thunder line', 2), ('Universe Note', 2), ('iStream', 2)]",17870,75.03,-37.8111309,144.952352,15,15264.53,Spring,False,0.4953,i love iassist!  i am surprised how much i use her.,True
ORD041753,ID5402983335,2019-10-09,Nickolson,"[('Toshika 750', 2), ('Lucent 330S', 1)]",9870,41.51,-37.8191281,144.9651789,15,8431.01,Spring,True,0.389,"not compatible with t-mobile pre-paid data plans got this phone and as hard as i tried to get it to work on the t-mobile data network, it just refused. wi-fi was great, but not on t-mobile pre-paid data plan. needless to say it proved useless while out of the house!",False
ORD392764,ID0128882451,2019-11-21,Bakers,"[('Candle Inferno', 1), ('Thunder line', 2)]",4790,101.78,-37.8016321,144.9973864,5,4652.28,Spring,True,0.9501,"great phone great phone! no complaints thus far! i came from a alcon 4s and will never look back. the windows phone 8 os is great, and feels like a breath of fresh air compared to android and ios. good job xp and msft.",True
ORD235342,ID2266562019,2019-05-11,Thompson,"[('Candle Inferno', 2), ('Alcon 10', 2), ('pearTV', 1), ('Lucent 330S', 1)]",26300,51.48,-37.8116326,144.95668419999996,15,22406.48,Autumn,False,0.8535,it was dirty inside screen was scratched very badly the phone had ... it was dirty inside screen was scratched very badly the phone had to be cleaned because it was terribly dirty.,False
ORD397482,ID6167266635,2019-03-08,Nickolson,"[('iAssist Line', 2), ('Lucent 330S', 2)]",6910,123.53999999999999,-37.8070748,144.962652,10,6342.54,Autumn,True,1.4187,worked great with canadian sim and we were able to transfer ... worked great with canadian sim and we were able to transfer our tracfone service as well. great to have only one phone. great customer support as we had a lot of questions at first.,True
ORD497794,ID0420022670,2019-08-21,Bakers,"[('Candle Inferno', 2), ('Olivia x460', 2)]",3310,61.61,-37.8111528,144.9975025,0,3371.61,Winter,False,0.2376,love it love it great camera and speed. and lots of options.,True
ORD366723,ID4315294434,2019-07-01,Thompson,"[('Olivia x460', 2), ('iStream', 2), ('Thunder line', 1)]",4930,75.32,-37.8170456,144.9532158,15,4265.82,Winter,True,0.7274,happy!! it works just great and purchased at a reasonable price. even though it's refurbished it looks brand new. nice packaging and it came with a charger and a 3 foot cord. i'm so glad i made this purchase. thank you.,True
ORD186329,ID3164000436,2019-12-23,Thompson,"[('Olivia x460', 1), ('Candle Inferno', 1), ('iAssist Line', 2), ('iStream', 1)]",6255,106.62,-37.8005276,144.9264467,25,4797.87,Summer,True,2.2622,good phone excellent phone for the dollars. 9.0 android has some really nice features.,True
ORD165386,ID0207085717,2019-08-24,Bakers,"[('Candle Inferno', 2), ('Thunder line', 1), ('Alcon 10', 1), ('Universe Note', 1)]",15440,83.1,-37.814424,145.0149411,10,13979.1,Winter,True,1.802,good phone not much more to say besides it's great.,True
ORD282765,ID5034416925,2019-03-05,Bakers,"[('Lucent 330S', 1), ('Olivia x460', 2), ('Candle Inferno', 1), ('Toshika 750', 2)]",12750,80.49,-37.800024,144.9948563,0,12830.49,Autumn,True,1.1106,excellent system 0k,True
ORD448997,ID0774527826,2019-01-18,Thompson,"[('pearTV', 2), ('Lucent 330S', 1)]",13850,77.75,-37.8062887,144.9593388,5,13235.25,Summer,False,1.2921,"i really like the phone i really like the phone, the only thing i do not understand is the issue of being korean, i understand that olivia is a chinese brand",True
ORD043946,ID0780992562,2019-06-14,Thompson,"[('Olivia x460', 1), ('Universe Note', 1)]",4675,39.415,-37.8056041,144.95362,5,4480.665,Winter,True,0.9753,"flexibility of usage perfect with the amount that i use a phone, this unlocked phone paired with tracfone is perfect for me.",True
ORD469779,ID0760180049,2019-12-25,Thompson,"[('Candle Inferno', 1), ('iStream', 2), ('pearTV', 1), ('Toshika 750', 1)]",11360,76.94,-37.8222687,144.9506507,0,11436.94,Summer,False,1.1136,"good device for the money device appears to be more expensive than actually is, i have been using it for like almost a year and no issues at all, even fell out to the floor and it resisted as champion",True
ORD438249,ID0387152937,2019-07-06,Thompson,"[('Alcon 10', 2), ('Thunder line', 2), ('Lucent 330S', 2), ('iAssist Line', 1)]",26945,50.3,-37.8083253,144.9434194,0,26995.3,Winter,False,0.5807,one star the worst phone i've ever owned,False
