order_id,customer_id,date,nearest_warehouse,shopping_cart,order_price,delivery_charges,customer_lat,customer_long,coupon_discount,order_total,season,is_expedited_delivery,distance_to_nearest_warehouse,latest_customer_review,is_happy_customer
ORD084647,ID0746909624,2019-06-01,Bakers,"[('pearTV', 1), ('Universe Note', 2)]",13210,85.49,-37.8227542,145.0140718,0,13295.49,Winter,True,2.1821,bought 2 i bought myself the note 6 back in january and so far i've had a great experienced with my phone. no issues. everything works just fine. battery life is amazing. last week i purchased another one for my youngest daughter as her old phone died. she loves it. i'm a total fan of xiaomi now.,True
ORD403147,ID0577522582,2019-09-21,Nickolson,"[('Lucent 330S', 2), ('iAssist Line', 1), ('Thunder line', 1)]",6865,99.5,-37.8219199,144.9725456,0,6964.5,Spring,True,0.4542,love phone love the phone. learning more about it everyday.,True
ORD290675,ID0575384236,2019-07-04,Nickolson,"[('iAssist Line', 1), ('Thunder line', 1), ('Candle Inferno', 2), ('iStream', 2)]",5565,63.54,-37.8200086,144.9816241,15,4793.79,Winter,True,1.0732,junk phone only lasted 6 months. i knew the product was not brand new but figured i would get more than 6 months of use out of it...,False
ORD026286,ID6167344514,2019-01-12,Nickolson,"[('Olivia x460', 2), ('Lucent 330S', 1)]",3680,73.63,-37.8098086,144.96688989999996,10,3385.63,Summer,False,1.0057,five stars it look very cool to me,True
ORD151567,ID2789606894,2019-11-21,Bakers,"[('Toshika 750', 1), ('Lucent 330S', 2), ('Olivia x460', 1), ('iAssist Line', 2)]",12455,106.55,-37.8024332,144.9831587,5,11938.8,Spring,True,1.3551,"awsome great phone gave it to my girlfriend she loved it. no problem so far with it, although she loves it more than me!!",True
ORD321289,ID0591276363,2019-05-05,Nickolson,"[('Olivia x460', 2), ('pearTV', 2), ('Candle Inferno', 1), ('iStream', 2)]",15800,66.59,-37.823809,144.9564558,15,13496.59,Autumn,False,1.2895,"very nice i haven't set it up yet, but it is ""like new"" condition. not a single mark on it. it powers up with no issues. looking forward in getting it all config'd.",True
ORD159985,ID0291966939,2019-05-07,Nickolson,"[('Toshika 750', 2), ('pearTV', 2), ('Alcon 10', 1), ('iStream', 2)]",30510,55.72,-37.8000371,144.9744259,25,22938.22,Autumn,False,2.1098,one star didnt come with a sim card can't use it,False
ORD076845,ID3132496573,2019-04-20,Nickolson,"[('Universe Note', 2), ('Alcon 10', 2), ('pearTV', 1), ('Toshika 750', 2)]",39750,64.36,-37.815015,144.96429840000005,0,39814.36,Autumn,False,0.6101,great phone like my phone,True
ORD321414,ID6167441073,2019-10-11,Nickolson,"[('Toshika 750', 1), ('Lucent 330S', 2), ('Candle Inferno', 1)]",7210,73.8,-37.8162009,144.9642033,10,6562.8,Spring,False,0.5405,price its absolutely worth it,True
ORD078985,ID0844488785,2019-09-20,Thompson,"[('Alcon 10', 2), ('Universe Note', 1)]",21350,60.69,-37.8209034,144.9480676,0,21410.69,Spring,False,0.9204,won't work on networks! bought this phone only to be told it would no longer work on network. waste of money and seller knew they would not work and did not say anything.,False
ORD471913,ID0634783940,2019-12-27,Thompson,"[('Universe Note', 2), ('Lucent 330S', 1), ('iAssist Line', 2), ('Candle Inferno', 2)]",13440,78.36,-37.81228770000001,144.9372642,0,13518.36,Summer,True,0.8633,one star i think this product may have been refurbished. it would constantly reboot itself.,False
ORD389157,ID0294624930,2019-03-24,Nickolson,"[('Lucent 330S', 1), ('Universe Note', 2), ('pearTV', 1)]",14440,78.5,-37.8190847,144.963387,25,10908.5,Autumn,True,0.5448,needed aninexpensive and portable iassist device and this works perfectly.,True
ORD148093,ID2935358337,2019-10-03,Bakers,"[('Toshika 750', 2), ('iStream', 2), ('Lucent 330S', 2), ('Olivia x460', 1)]",12625,93.09,-37.82717810000001,144.9940628,0,12718.09,Spring,True,1.9154,worst vedio shown as black white.phone getting hot while charged.clarity of pic not worth.battery getting drained easily.,False
ORD375406,ID2481930364,2019-11-06,Bakers,"[('Lucent 330S', 1), ('Candle Inferno', 2), ('Universe Note', 2)]",8990,73.4,-37.80551060000001,144.9986564,10,8164.4,Spring,False,0.5831,great phone all good for money,True
ORD265577,ID4655129062,2019-06-21,Thompson,"[('Candle Inferno', 2), ('Olivia x460', 1), ('Universe Note', 1), ('Lucent 330S', 2)]",7995,62.22,-37.8096634,144.9475724,0,8057.22,Winter,False,0.338,five stars it works perfectly. just as expected.,True
ORD130751,ID1224854729,2019-06-08,Thompson,"[('iStream', 2), ('Candle Inferno', 2)]",1160,77.44,-37.8133291,144.939352,15,1063.44,Winter,True,0.6826,. good phone in that price.,True
ORD142889,ID0774519013,2019-05-19,Thompson,"[('Alcon 10', 1), ('Lucent 330S', 2), ('iAssist Line', 2)]",15860,80.18,-37.8064508,144.9594605,25,11975.18,Autumn,True,1.2913,the speakers arent too loud.. iassist is great though. besides that naw,True
ORD169142,ID4305736587,2019-07-08,Bakers,"[('Candle Inferno', 2), ('iStream', 2)]",1160,67.22,-37.8131224,145.0139936,5,1169.22,Winter,True,1.6863,internal problems had internal problems. i knew it was refurbished but he said it worked.,False
ORD119431,ID1985557912,2019-11-11,Nickolson,"[('Candle Inferno', 1), ('Lucent 330S', 1)]",1660,85.06,-37.8117833,144.967729,10,1579.06,Spring,True,0.775,one star does not work on sprint!!!!!!,False
ORD200170,ID3610014310,2019-07-13,Bakers,"[('Lucent 330S', 2), ('iAssist Line', 2)]",6910,52.47,-37.8171722,144.98605869999997,5,6616.97,Winter,False,1.1353,two stars didn't like,False
ORD491064,ID0207078719,2019-03-27,Bakers,"[('Lucent 330S', 2), ('pearTV', 1)]",8770,71.61,-37.8211747,145.01544950000005,0,8841.61,Autumn,False,2.1701,"i love xp i love xp,it very good.",True
ORD345591,ID1131986113,2019-05-25,Thompson,"[('pearTV', 2), ('Olivia x460', 1), ('Candle Inferno', 2), ('Universe Note', 1)]",18155,78.26,-37.8150862,144.9450741,15,15510.01,Autumn,True,0.3208,"good phone, but buy it new or actually refurbished. great phone, was pretty beat up beyond what the description lead me to believe, the box was from asia, so setting it up for english was fun... also the camera appears to be defective at times, takes solid white photos.",True
ORD293542,ID0266738765,2019-08-28,Nickolson,"[('Olivia x460', 1), ('Toshika 750', 2), ('Thunder line', 1)]",12045,78.88,-37.8205264,144.9806994,10,10919.38,Winter,True,1.0036,my daughter just loved this candle inferno. she said it was the perfect gift that she could receive.,True
ORD029887,ID0282825791,2019-06-25,Thompson,"[('Thunder line', 2), ('Lucent 330S', 1), ('Candle Inferno', 2), ('Toshika 750', 2)]",15090,52.45,-37.8019411,144.94870680000002,0,15142.45,Winter,False,1.2033,"se congela la pantalla tengo problemas con este tel茅fono, ya que desde el inicio de su compra se le congela la pantalla, no lo recomiendo es muy malo",False
ORD279422,ID3293340269,2019-03-11,Nickolson,"[('Lucent 330S', 2), ('Universe Note', 2), ('pearTV', 1), ('Candle Inferno', 2)]",16530,80.56,-37.8252749,144.9817565,15,14131.06,Autumn,True,1.3057,it is a great phone. very easy to transfer all my contacts ... it is a great phone. very easy to transfer all my contacts and apps from my old universe s3 and works great with cricket wireless.,True
ORD192062,ID0598154601,2019-09-22,Nickolson,"[('pearTV', 1), ('Toshika 750', 1), ('Lucent 330S', 2), ('Olivia x460', 2)]",15540,58.07,-37.8175628,144.9673906,25,11713.07,Spring,False,0.222,arrived in damaged condition the phone has scratches. i returned it and waiting for my full refund. very disappointed.,False
ORD241369,ID0282854647,2019-11-04,Bakers,"[('Candle Inferno', 2), ('Universe Note', 2), ('pearTV', 1)]",14070,171.14999999999998,-37.7997219,145.0186542,0,14241.15,Spring,True,2.3562,super easy to set up.  easy to use. lots of app options available.,True
ORD293062,ID6167344367,2019-10-14,Nickolson,"[('Universe Note', 2), ('Olivia x460', 2), ('iAssist Line', 1)]",11575,74.16,-37.81470570000001,144.96882069999995,10,10491.66,Spring,False,0.4377,i bought this for my mother for christmas. she is not the most technological advanced individual. she really wanted a tablet and this one works great and is super easy to use. i went to program it for her and she insisted on doing it herself. she was able to no problem!,True
ORD140091,ID0317729759,2019-09-09,Thompson,"[('iAssist Line', 2), ('Lucent 330S', 1), ('Olivia x460', 1)]",6905,78.18,-37.8091736,144.9563099,10,6292.68,Spring,False,0.9012,awesome phone and price. good phone so far. it's not a typical android interface so it'll take some getting used to.,True
ORD383249,ID0589424504,2019-01-22,Nickolson,"[('Olivia x460', 2), ('iStream', 1), ('Lucent 330S', 2), ('Universe Note', 1)]",8510,93.92,-37.8095776,144.97265339999996,5,8178.42,Summer,True,1.0402,"good quality phone. well built, good power, no glitches. i've had many android phones like olivia, lg, and huawei. this is my 3rd lucentrola, and they consistently have had good build quality.",True
ORD120623,ID1833115018,2019-02-28,Thompson,"[('Candle Inferno', 2), ('Universe Note', 2), ('pearTV', 2)]",20380,109.77000000000001,-37.8077923,144.95450280000003,10,18451.77,Summer,False,0.8501,battery life i've been enjoying my phone. had 2 note 4 before and i'm glad i went back.,True
ORD440348,ID0301548220,2019-06-05,Bakers,"[('Universe Note', 1), ('Alcon 10', 2), ('iAssist Line', 2), ('Candle Inferno', 1)]",26230,33.125,-37.8065557,144.9852247,15,22328.625,Winter,False,0.9598,"gets the job done and mom is happy not having to ""learn"" another phone simple. gets the job done and mom is happy not having to ""learn"" another phone.",True
ORD315949,ID4283908893,2019-01-05,Nickolson,"[('Olivia x460', 2), ('Lucent 330S', 1), ('Alcon 10', 1)]",12630,72.81,-37.81249920000001,144.9742733,10,11439.81,Summer,False,0.7956,build like a tank but... as always xp phones are build like a tank but... poor camera front and rear cam has this redness cloud in the screen.,True
ORD027389,ID0247532604,2019-11-30,Thompson,"[('Alcon 10', 1), ('pearTV', 2)]",21570,99.84,-37.8177563,144.95163159999996,25,16277.34,Spring,True,0.6937,"very good. good buy works very well, very good. good buy.",True
ORD061963,ID0589398626,2019-06-22,Nickolson,"[('Candle Inferno', 2), ('iAssist Line', 2), ('Thunder line', 1)]",7490,63.73,-37.8123696,144.9736957,0,7553.73,Winter,False,0.783,...that is works after awhile and gives me no issues it was a good phone for about 3 to 4 years but it blacked out had to upgrade.,True
ORD095042,ID1545387649,2019-04-06,Thompson,"[('Universe Note', 1), ('Thunder line', 2)]",7810,81.25,-37.8009923,144.9566858,10,7110.25,Autumn,True,1.5512,very cool and lots of fun! used for a week and still learning its capabilities.,True
ORD211188,ID6167344493,2019-02-28,Nickolson,"[('Universe Note', 2), ('Alcon 10', 2)]",24800,75.84,-37.8087126,144.9663936,10,22395.84,Summer,False,1.1346,phone activated perfectly on verizon account. only downside is ... phone activated perfectly on verizon account. only downside is no warranty. if you buy this make sure you get the warranty. these phones are expensive to replace,True
ORD422869,ID0222987367,2019-03-18,Bakers,"[('Thunder line', 1), ('Toshika 750', 2), ('Lucent 330S', 2), ('iStream', 2)]",13580,98.17500000000001,-37.8067851,144.9880745,15,11641.175,Autumn,False,0.7239,this phone is durable. this is the first phone i bought online and i am not disappointed. so far i have dropped it 4 times without a case and it did not take any damage.,True
ORD011398,ID0769188525,2019-04-19,Nickolson,"[('Toshika 750', 1), ('Universe Note', 2)]",11220,103.59,-37.8011793,144.9739477,10,10201.59,Autumn,False,1.9769,great phone love love love this phone it is everything i was looking for. the camera is practically in hd. if i was given the option to purchase again i will,True
ORD487963,ID1492410217,2019-05-21,Nickolson,"[('Universe Note', 1), ('Lucent 330S', 2), ('iStream', 1)]",6060,67.8,-37.8045134,144.96317480000005,15,5218.8,Autumn,False,1.6648,excellent purchase. came as advertised. blemish free and performs like new. looking forward too years of use.,True
ORD138343,ID1668523241,2019-07-16,Nickolson,"[('iAssist Line', 2), ('Lucent 330S', 2), ('Candle Inferno', 1)]",7340,75.01,-37.820351,144.9640389,25,5580.01,Winter,True,0.5226,"great phone for the money i need a cheap phone for foreign travel and found that this recently released phone has pretty good reviews. to be honest, its just as good as my alcon 6 in most ways, though the audio is not quite as good. for the money, a great phone.",True
ORD371712,ID4315295084,2019-08-11,Bakers,"[('Thunder line', 2), ('Toshika 750', 1), ('pearTV', 2)]",21300,60.18,-37.8166534,144.9906965,15,18165.18,Winter,True,0.8416,being able to use the product i pay for. the phone was locked and verizon would not unlock it. t-mobile is my carrier and they couldn't unlock the phone and they tried to get verizon to unlock it and they refused. sending it back. can't use a locked phone.,False
ORD317628,ID3144992707,2019-02-19,Bakers,"[('iAssist Line', 1), ('pearTV', 2), ('Olivia x460', 2), ('Toshika 750', 1)]",21615,45.555,-37.8140575,144.9901368,10,19499.055,Summer,True,0.6365,good good phone for price,True
ORD201106,ID4518401167,2019-04-07,Thompson,"[('iAssist Line', 2), ('pearTV', 2), ('Olivia x460', 1), ('Alcon 10', 2)]",36195,65.51,-37.8070107,144.9490826,15,30831.26,Autumn,False,0.6547,five stars fantastic,True
ORD050423,ID0371972624,2019-05-13,Nickolson,"[('Candle Inferno', 1), ('Toshika 750', 1), ('Lucent 330S', 1), ('Alcon 10', 1)]",14930,52.8,-37.8064398,144.9721477,15,12743.3,Autumn,False,1.3722,"i'm waiting for the phone!!! months van varios meses. y no me entregan ni el celular , ni devuelven el dinero!",False
ORD084250,ID3804569172,2019-11-24,Bakers,"[('Alcon 10', 1), ('iStream', 2), ('Olivia x460', 2)]",11700,89.45,-37.8202297,144.9894253,15,10034.45,Spring,True,1.2484,"i do not recommend the item or company this item is not unlocked to all networks, only to at&t. i do not recommend the item or company company xp lumia 635 at&t gsm unlocked rm-975 4g lte 8gb windows 8.1 smartphone - black.",False
ORD175166,ID4312130284,2019-11-09,Bakers,"[('Olivia x460', 2), ('Thunder line', 1), ('iAssist Line', 2), ('pearTV', 1)]",15390,62.14,-37.8199256,144.99215690000003,5,14682.64,Spring,False,1.1379,"such waste of im using metro pcs and it always said ""phone not allowed mm#6"" and the description said its unlock phone but still is not unlock , now i cant use the phone !! thank you ! such waste of money",False
ORD079876,ID6167418092,2019-09-17,Nickolson,"[('Toshika 750', 2), ('iStream', 1), ('Thunder line', 1)]",10970,78.98,-37.8112033,144.9731309,10,9951.98,Spring,False,0.881,im loving it so far so good,True
ORD241319,ID4162427921,2019-07-07,Nickolson,"[('iStream', 1), ('Candle Inferno', 2)]",1010,61.55,-37.8197057,144.9706935,0,1071.55,Winter,False,0.1593,works great. easy set up.,True
ORD131444,ID0588197311,2019-04-16,Nickolson,"[('Candle Inferno', 2), ('pearTV', 1), ('Olivia x460', 2), ('Thunder line', 1)]",11800,49.37,-37.8121065,144.9738372,10,10669.37,Autumn,False,0.8147,not an unlocked phone. i bought this phone as a present for my uncle and i was greatly mortified when i realised it was locked after i gave it to him and transferred all his stuff onto it.,False
ORD389175,ID0781006787,2019-10-03,Thompson,"[('iStream', 2), ('pearTV', 2), ('Toshika 750', 2), ('iAssist Line', 1)]",23785,103.22,-37.8029968,144.9494294,0,23888.22,Spring,True,1.097,"good speed compared to the other models just the size and weighs very little. large viewing area for a 8"" tablet hd",True
ORD242374,ID0448103554,2019-09-05,Thompson,"[('Toshika 750', 2), ('Candle Inferno', 1), ('Lucent 330S', 2), ('pearTV', 1)]",17840,104.21,-37.81524829999999,144.93410730000005,0,17944.21,Spring,True,1.1753,the screen picture is crisp and bright. i will use this tablet for many things.,True
ORD427103,ID0248746725,2019-08-15,Bakers,"[('Candle Inferno', 2), ('pearTV', 2), ('iStream', 1), ('Alcon 10', 2)]",31530,64.4,-37.8151859,144.9939064,0,31594.4,Winter,False,0.5894,the phone meet my expectations. late but its fine and work fine.,True
ORD132870,ID4520380489,2019-09-13,Thompson,"[('iAssist Line', 2), ('Lucent 330S', 2), ('Universe Note', 2)]",13810,154.23,-37.8064681,144.9558626,5,13273.73,Spring,True,1.0369,this phone brings me joy. i've used prepaid phones for years and i have to say this is the best one by far. i am happy and will buy again.,True
ORD048868,ID0144720206,2019-05-02,Nickolson,"[('Toshika 750', 1), ('Alcon 10', 1), ('pearTV', 1)]",19580,100.995,-37.8204972,144.95670890000005,25,14785.995,Autumn,False,1.1489,i bought this for my 6 year old and it's perfect. faster & clearer than older versions.,True
ORD065544,ID0660546020,2019-05-30,Bakers,"[('iStream', 1), ('Lucent 330S', 2)]",2610,63.95,-37.81184,144.98924530000005,10,2412.95,Autumn,False,0.5651,great superb.... exactly what i wanted.. no issues,True
ORD006510,ID0137172748,2019-07-26,Thompson,"[('Alcon 10', 1), ('Thunder line', 2), ('Candle Inferno', 2), ('Universe Note', 1)]",17620,78.56,-37.8049481,144.9562368,0,17698.56,Winter,True,1.1788,"annoying. otherwise i really like the phone has some sort of glitch. freezes up, some sort of pop-up message about google. i have to do a master reset. annoying. otherwise i really like the phone. very durable. easy to use for a newbie to smart phones.",True
ORD123289,ID1463620602,2019-02-20,Bakers,"[('Thunder line', 1), ('Candle Inferno', 1)]",2610,62.81,-37.8174936,145.00401730000004,15,2281.31,Summer,False,1.1373,incorrect advertisement phone was not unlocked as advertised,False
ORD252170,ID2279153646,2019-09-18,Nickolson,"[('Lucent 330S', 1), ('iAssist Line', 1), ('Alcon 10', 2), ('Candle Inferno', 2)]",22215,76.72,-37.8122037,144.9745305,0,22291.72,Spring,False,0.8354,so-so i love windows and xp but the screen is not as sensitive to touch as it should be,True
ORD474093,ID0579490936,2019-09-17,Thompson,"[('Candle Inferno', 2), ('Alcon 10', 1)]",9810,73.03,-37.8151395,144.95044099999996,10,8902.03,Spring,False,0.4041,"this phone has all the relevant functions, and all these functions are perfectly implemented. fantastic smartphone! bravo lucentrola!",True
ORD143690,ID0575434375,2019-07-15,Nickolson,"[('Toshika 750', 1), ('iAssist Line', 1), ('Candle Inferno', 1), ('Olivia x460', 1)]",8200,67.03,-37.8207703,144.9848428,15,7037.03,Winter,False,1.3663,"great product, and i like the screen for a alarm clock",True
ORD210589,ID6167229075,2019-01-14,Nickolson,"[('Candle Inferno', 2), ('iStream', 2), ('Alcon 10', 1)]",10110,93.94,-37.8205448,144.95745459999995,0,10203.94,Summer,True,1.0856,four stars the cel phone came with a burned pixel that didnt fix... the rest was ok,True
ORD018458,ID5884356129,2019-11-17,Thompson,"[('Lucent 330S', 2), ('Olivia x460', 2), ('Thunder line', 2)]",9270,81.36,-37.823717,144.9376977,5,8887.86,Spring,False,1.48,i love the camera on this thing i love the camera on this thing! i want to do nothing but take pics and videos all day.,True
ORD040899,ID2641765498,2019-08-29,Nickolson,"[('Thunder line', 1), ('pearTV', 1), ('iStream', 2), ('Alcon 10', 1)]",17740,67.16,-37.8228248,144.95794919999997,15,15146.16,Winter,False,1.1236,great great product and service,True
ORD374428,ID2885195904,2019-01-11,Nickolson,"[('iStream', 1), ('Olivia x460', 1), ('Toshika 750', 2), ('Candle Inferno', 1)]",10445,78.74,-37.80465870000001,144.97134519999997,0,10523.74,Summer,False,1.5594,works fine was as pictured and is functioning great.,True
ORD300217,ID2202858906,2019-02-19,Thompson,"[('Toshika 750', 1), ('Lucent 330S', 1), ('Alcon 10', 1)]",14500,76.34,-37.82144,144.9538043,15,12401.34,Summer,False,1.1416,very happy. i broke the glass on the one i've ... very happy. i broke the glass on the one i've had for 3+ yrs. this one is identical. perfect size for me. the newer ones won't fit a shirt pocket anymore,True
ORD446860,ID0373644746,2019-06-01,Thompson,"[('Candle Inferno', 2), ('Thunder line', 1), ('iAssist Line', 1), ('Toshika 750', 2)]",13905,69.4,-37.8083237,144.9212169,5,13279.15,Winter,True,2.3245,speaker issues the speaker worked very poorly. you can barely hear someone speak even when the volume is all the way up,False
ORD400367,ID2069174452,2019-10-24,Bakers,"[('Alcon 10', 1), ('Toshika 750', 1), ('iAssist Line', 2)]",17720,106.38,-37.8002402,144.984491,25,13396.38,Spring,True,1.4394,five stars so far so good!,True
ORD280473,ID4516157159,2019-12-27,Thompson,"[('Candle Inferno', 2), ('Lucent 330S', 1), ('Alcon 10', 1)]",11040,76.41,-37.8206574,144.94119650000005,0,11116.41,Summer,False,1.0279,great phone great price like everything disklike nothing,True
ORD369615,ID0298045598,2019-12-06,Nickolson,"[('pearTV', 2), ('Candle Inferno', 2)]",13480,93.54,-37.823214,144.9651841,5,12899.54,Summer,True,0.6417,the technology is the best i have ever seen. great phone. this is my second one. this one is for my wife. she saw how good mine was and now she has her own.,True
ORD475067,ID0021578117,2019-01-25,Thompson,"[('Toshika 750', 2), ('Alcon 10', 2)]",26540,87.78,-37.8116151,144.94564430000003,5,25300.78,Summer,True,0.172,"dope perfect, highly recommended, don't waste your money on $750 us version, at the end they are both gonna do the same work.",True
ORD475261,ID0579502235,2019-05-16,Thompson,"[('Candle Inferno', 1), ('iAssist Line', 1)]",2655,78.24,-37.8148461,144.9506248,0,2733.24,Autumn,True,0.3953,works perfect amazing phone works great,True
ORD462387,ID0477079436,2019-08-22,Nickolson,"[('Toshika 750', 1), ('Candle Inferno', 1)]",4750,79.54,-37.8078471,144.9744618,10,4354.54,Winter,True,1.272,five stars super awesome phone! i am loving it so far.,True
ORD249714,ID3185718965,2019-05-07,Bakers,"[('pearTV', 2), ('Olivia x460', 2), ('Thunder line', 1)]",17250,68.14,-37.7991923,144.98766609999996,10,15593.14,Autumn,False,1.3745,"would buy again good, wellmade, piece of equipment.",True
ORD423434,ID0579392261,2019-03-20,Nickolson,"[('Toshika 750', 1), ('Thunder line', 1), ('iAssist Line', 1)]",8725,52.68,-37.822232,144.9559424,10,7905.18,Autumn,False,1.2633,difficult to use the phone came with very little information and getting a booklet on line was impossible. the features were difficult to assess and the volume control wa snot working.,False
ORD289724,ID2877340267,2019-02-08,Bakers,"[('Candle Inferno', 2), ('Thunder line', 1), ('Universe Note', 2)]",9940,102.33,-37.82149,145.0052602,0,10042.33,Summer,True,1.5539,fun taking to the tv. works good. its a little confusing moving around the programs.,True
ORD458949,ID6167191697,2019-02-19,Thompson,"[('Toshika 750', 2), ('Olivia x460', 2), ('pearTV', 1), ('iAssist Line', 2)]",21850,75.66,-37.818865,144.9548997,5,20833.16,Summer,False,0.9743,"works fine, had a scratch on back. love the phone. i gave it a 4 overall because it came with a scratch on the back. i understand it's refurbished and these things can be expected, but that's why i gave it a four star rating. other than the scratch on the back, everything seems to work fine so far!",True
ORD478431,ID0356125087,2019-08-05,Nickolson,"[('Candle Inferno', 1), ('iAssist Line', 1), ('iStream', 2), ('Toshika 750', 1)]",7275,78.27,-37.8165761,144.98014730000003,15,6262.02,Winter,True,0.9585,i love it i like this phone,True
ORD152105,ID2133731374,2019-12-13,Thompson,"[('Universe Note', 2), ('Thunder line', 2), ('Candle Inferno', 2), ('Alcon 10', 2)]",30020,128.97,-37.8145736,144.946566,15,25645.97,Summer,True,0.2161,"great phone take a little time to get use to the windows 8 os, and there aren't as many apps, but overall it a great phone",True
ORD182189,ID1953967173,2019-09-03,Thompson,"[('Lucent 330S', 2), ('Thunder line', 2), ('Candle Inferno', 2)]",7680,107.9,-37.8019674,144.9594925,0,7787.9,Spring,True,1.6168,"nice looking, powerful phone i have been using it for less than a week. so far, so good!",True
ORD130294,ID5002595124,2019-06-30,Thompson,"[('Thunder line', 2), ('Olivia x460', 2), ('iStream', 2), ('Alcon 10', 2)]",25010,113.14500000000001,-37.812211,144.9531266,15,21371.645,Winter,True,0.5352,excellent condition it works great..!,True
ORD196414,ID0746918008,2019-12-28,Nickolson,"[('Toshika 750', 1), ('iStream', 2)]",4620,99.03,-37.8243701,144.9828365,15,4026.03,Summer,True,1.3334,love this tablet! super bright colors! great for gamers! can't bet this tablet for any price!,True
ORD453672,ID1879180936,2019-12-28,Thompson,"[('pearTV', 1), ('Olivia x460', 2), ('iAssist Line', 1), ('Toshika 750', 1)]",15305,84.61,-37.799533200000006,144.9600147,5,14624.36,Summer,False,1.8536,five stars love it !,True
ORD484303,ID2713724549,2019-06-02,Nickolson,"[('pearTV', 2), ('Thunder line', 1), ('Olivia x460', 2), ('iStream', 2)]",17550,63.52,-37.8133369,144.96269009999997,15,14981.02,Winter,True,0.8406,"do not recommend battery dying very fast, if in usage battery will last 1 hour and stand by only 6 hours.",False
ORD099115,ID0579410717,2019-09-02,Nickolson,"[('Universe Note', 1), ('pearTV', 1), ('Lucent 330S', 2), ('Thunder line', 1)]",14400,74.49,-37.821937,144.9683219,10,13034.49,Spring,False,0.3874,"works as expected. i enjoy reading newspaper articles, books, as well as banking apps and social media tools.",True
ORD283059,ID5402876203,2019-04-30,Nickolson,"[('Universe Note', 2), ('iStream', 2), ('Olivia x460', 1), ('iAssist Line', 2)]",12875,32.67,-37.8217389,144.9779324,10,11620.17,Autumn,False,0.8159,"good for the price i wish the front camera was better but for the price i paid $127, this is a great phone.",True
ORD244510,ID2716423441,2019-03-21,Thompson,"[('Alcon 10', 1), ('Toshika 750', 2), ('iStream', 2)]",17890,118.005,-37.81442360000001,144.946891,25,13535.505,Autumn,True,0.1955,"this is a very good tablet for the price, especially for digico gold members. the display is very sharp and so far the battery life is excellent!",True
